{
  "$schema": "https://json-schema.org/draft/2020-12/schema",
  "additionalProperties": false,
  "properties": {
    "fields": {
      "items": {
        "additionalProperties": false,
        "properties": {
          "artifact_path": {
            "type": "string"
          },
          "found": {
            "type": "boolean"
          },
          "json_pointer": {
            "type": "string"
          },
          "label": {
            "type": "string"
          },
          "reason": {
            "type": [
              "string",
              "null"
            ]
          },
          "value": true
        },
        "required": [
          "artifact_path",
          "label",
          "json_pointer",
          "found",
          "value",
          "reason"
        ],
        "type": "object"
      },
      "type": "array"
    },
    "limitations": {
      "items": {
        "type": "string"
      },
      "type": "array"
    },
    "schema_version": {
      "const": "1.0"
    },
    "semantic_authority": {
      "const": "NONE"
    }
  },
  "required": [
    "schema_version",
    "semantic_authority",
    "fields",
    "limitations"
  ],
  "title": "Extracted Field Index",
  "type": "object"
}
