{
  "fields": [
    {
      "artifact_path": "environment/environment.json",
      "found": true,
      "json_pointer": "/cbmc_version",
      "label": "cbmc_version",
      "reason": null,
      "value": "6.9.0"
    },
    {
      "artifact_path": "environment/environment.json",
      "found": true,
      "json_pointer": "/platform",
      "label": "platform",
      "reason": null,
      "value": "ubuntu-24.04"
    },
    {
      "artifact_path": "cbmc/cbmc.execution_summary.json",
      "found": true,
      "json_pointer": "/cbmc_reported_result",
      "label": "reported_result",
      "reason": null,
      "value": "PASS_REPORTED_BY_CBMC"
    },
    {
      "artifact_path": "cbmc/cbmc.execution_summary.json",
      "found": true,
      "json_pointer": "/properties/failed",
      "label": "failed_properties",
      "reason": null,
      "value": 0
    },
    {
      "artifact_path": "skills/spec/grounding_report.json",
      "found": true,
      "json_pointer": "/status",
      "label": "grounding_status",
      "reason": null,
      "value": "COMPLETE"
    },
    {
      "artifact_path": "skills/build/build_context_report.json",
      "found": true,
      "json_pointer": "/target",
      "label": "mapped_target",
      "reason": null,
      "value": "vector_subtract"
    },
    {
      "artifact_path": "repairs/iteration-1.json",
      "found": true,
      "json_pointer": "/change_summary_supplied_by_codex",
      "label": "repair_summary",
      "reason": null,
      "value": "Adjusted the caller-created assertion indexing."
    }
  ],
  "limitations": [
    "Values are copied from caller-selected JSON Pointers without interpretation."
  ],
  "schema_version": "1.0",
  "semantic_authority": "NONE"
}
